{
  "id": "tr-destructive-demo-001",
  "protocol": "trigger/0.3",
  "proposal_id": "delete-demo-001",
  "proposal_hash": "sha256:3333333333333333333333333333333333333333333333333333333333333333",
  "decision_id": "decision-delete-demo-001",
  "actor": "human:demo-operator",
  "authority_id": "demo-destructive-action",
  "action": "mcp.tools/call",
  "scope": "delete_file",
  "issued_at": "2026-09-19T00:00:00Z",
  "expires_at": "2099-01-01T00:00:00Z",
  "nonce": "demo-delete-001",
  "extensions": {
    "https://trigger-protocol.org/ns/mcp-proxy": {
      "tool_name": "delete_file",
      "arguments_sha256": "36e7b77f253b8788d8cceff22ef944063582013502626ace3f506b4838791a10"
    }
  }
}
